{
  "$schema": "https://json-schema.org/draft/2020-12/schema",
  "$id": "https://ground.ink/schemas/ground-core/state-patch/v0.1.24",
  "title": "GROUND Core StatePatch",
  "description": "Incremental update to ProjectState. Supports Reality ontic + Epistemic Core + Reference State + Objective Core + Prospective + Impact Core + Impact Measurement + Governance Core + Authority Provenance + Capability Core ops + Permission Core + Decision Core + Agency Composition. + Intent Core I. + Commitment Core I. + Commitment Acceptance. + Commitment Temporal Terms. + Commitment Conditional Terms. + Resource Commitment Core I. + Resource Reservation Core I.",
  "type": "object",
  "required": [
    "schema_version",
    "project_id",
    "source",
    "operations"
  ],
  "additionalProperties": false,
  "properties": {
    "schema_version": {
      "type": "string",
      "enum": [
        "0.1.0",
        "0.1.1",
        "0.1.2",
        "0.1.3",
        "0.1.4",
        "0.1.5",
        "0.1.6",
        "0.1.7",
        "0.1.8",
        "0.1.9",
        "0.1.10",
        "0.1.11",
        "0.1.12",
        "0.1.13",
        "0.1.14",
        "0.1.15",
        "0.1.16",
        "0.1.17",
        "0.1.18",
        "0.1.19",
        "0.1.20",
        "0.1.21",
        "0.1.22",
        "0.1.23",
        "0.1.24"
      ]
    },
    "project_id": {
      "type": "string",
      "format": "uuid"
    },
    "source": {
      "type": "string",
      "enum": [
        "manual",
        "extraction",
        "import",
        "human_review"
      ]
    },
    "operations": {
      "type": "array",
      "minItems": 1,
      "items": {
        "$ref": "#/$defs/patch_operation"
      }
    },
    "applied_at": {
      "type": "string",
      "format": "date-time"
    }
  },
  "$defs": {
    "patch_op": {
      "type": "string",
      "enum": [
        "upsert",
        "status_change",
        "delete"
      ]
    },
    "patch_entity": {
      "type": "string",
      "enum": [
        "project",
        "goal",
        "current_state",
        "blocker",
        "next_action",
        "decision",
        "hypothesis",
        "reference_doc",
        "observation",
        "judgment",
        "reality_entity",
        "reality_event",
        "reality_state",
        "epistemic_observation",
        "evidence",
        "claim",
        "claim_evidence_link",
        "reference_condition",
        "reality_objective",
        "objective_requirement",
        "objective_dependency",
        "future_scenario",
        "scenario_state_projection",
        "scenario_likelihood_estimate",
        "impact_declaration",
        "impact_measure_declaration",
        "authority_declaration",
        "standing_declaration",
        "mandate_declaration",
        "authority_delegation_declaration",
        "authority_contest_declaration",
        "capability_declaration",
        "capability_verification_declaration",
        "capability_availability_declaration",
        "resource_declaration",
        "resource_capacity_declaration",
        "resource_availability_declaration",
        "intervention_declaration",
        "intervention_capability_requirement_declaration",
        "intervention_resource_requirement_declaration",
        "intervention_permission_declaration",
        "decision_space_declaration",
        "decision_option_declaration",
        "decision_option_actor_candidate_declaration",
        "reality_decision_declaration",
        "intervention_intent_declaration",
        "intervention_commitment_declaration",
        "intervention_commitment_acceptance_declaration",
        "intervention_commitment_temporal_term_declaration",
        "intervention_commitment_conditional_term_declaration",
        "intervention_resource_commitment_declaration",
        "intervention_resource_reservation_declaration"
      ]
    },
    "patch_operation": {
      "type": "object",
      "required": [
        "op",
        "entity",
        "entity_id"
      ],
      "additionalProperties": false,
      "properties": {
        "op": {
          "$ref": "#/$defs/patch_op"
        },
        "entity": {
          "$ref": "#/$defs/patch_entity"
        },
        "entity_id": {
          "type": "string",
          "format": "uuid"
        },
        "payload": {
          "type": "object",
          "additionalProperties": true
        },
        "status": {
          "type": "string"
        }
      },
      "allOf": [
        {
          "if": {
            "properties": {
              "op": {
                "const": "upsert"
              }
            },
            "required": [
              "op"
            ]
          },
          "then": {
            "required": [
              "payload"
            ]
          }
        },
        {
          "if": {
            "properties": {
              "op": {
                "const": "status_change"
              }
            },
            "required": [
              "op"
            ]
          },
          "then": {
            "required": [
              "status"
            ]
          }
        }
      ]
    }
  }
}
