{
  "schema_version": "0.1.24",
  "project_id": "19041904-1904-4904-8904-190419045001",
  "source": "import",
  "operations": [
    {
      "op": "upsert",
      "entity": "reality_entity",
      "entity_id": "6c28f14a-9a0a-5e13-ac43-7e925d62d508",
      "payload": {
        "id": "6c28f14a-9a0a-5e13-ac43-7e925d62d508",
        "project_id": "19041904-1904-4904-8904-190419045001",
        "kind": "document",
        "label": "FRUS 1904, document 392",
        "attrs": {
          "experimental_source_identity": "frus:1904:392"
        },
        "created_at": "2026-09-14T00:00:00.000Z",
        "updated_at": "2026-09-14T00:00:00.000Z"
      }
    },
    {
      "op": "upsert",
      "entity": "evidence",
      "entity_id": "431cf101-bc13-5900-aa17-4cfd8691ec00",
      "payload": {
        "project_id": "19041904-1904-4904-8904-190419045001",
        "recorded_at": "2026-09-14T00:00:00.000Z",
        "created_at": "2026-09-14T00:00:00.000Z",
        "updated_at": "2026-09-14T00:00:00.000Z",
        "id": "431cf101-bc13-5900-aa17-4cfd8691ec00",
        "kind": "external_ref",
        "observation_id": null,
        "external_ref": "https://history.state.gov/historicaldocuments/frus1904/d392",
        "summary": "edition_text_inspected; locator {\"document_number\":\"392\",\"page\":{\"status\":\"unknown\",\"reason\":\"HTML page marker not inspected for this record\"}}",
        "provenance": {
          "kind": "document",
          "entity_id": "6c28f14a-9a0a-5e13-ac43-7e925d62d508",
          "external_id": "frus:1904:392",
          "label": "FRUS 1904, document 392"
        }
      }
    },
    {
      "op": "upsert",
      "entity": "reality_entity",
      "entity_id": "94deaf67-b2d7-5e36-ac70-c395f0100226",
      "payload": {
        "id": "94deaf67-b2d7-5e36-ac70-c395f0100226",
        "project_id": "19041904-1904-4904-8904-190419045001",
        "kind": "document",
        "label": "FRUS 1904, document 393",
        "attrs": {
          "experimental_source_identity": "frus:1904:393"
        },
        "created_at": "2026-09-14T00:00:00.000Z",
        "updated_at": "2026-09-14T00:00:00.000Z"
      }
    },
    {
      "op": "upsert",
      "entity": "evidence",
      "entity_id": "25e7fbd7-9e3e-53fc-a33f-3ea1d89ea104",
      "payload": {
        "project_id": "19041904-1904-4904-8904-190419045001",
        "recorded_at": "2026-09-14T00:00:00.000Z",
        "created_at": "2026-09-14T00:00:00.000Z",
        "updated_at": "2026-09-14T00:00:00.000Z",
        "id": "25e7fbd7-9e3e-53fc-a33f-3ea1d89ea104",
        "kind": "external_ref",
        "observation_id": null,
        "external_ref": "https://history.state.gov/historicaldocuments/frus1904/d393",
        "summary": "edition_text_inspected; locator {\"document_number\":\"393\",\"page\":{\"status\":\"unknown\",\"reason\":\"HTML page marker not inspected for this record\"}}",
        "provenance": {
          "kind": "document",
          "entity_id": "94deaf67-b2d7-5e36-ac70-c395f0100226",
          "external_id": "frus:1904:393",
          "label": "FRUS 1904, document 393"
        }
      }
    },
    {
      "op": "upsert",
      "entity": "reality_entity",
      "entity_id": "8ced5500-e3eb-552a-a32c-4a78a58d59a8",
      "payload": {
        "id": "8ced5500-e3eb-552a-a32c-4a78a58d59a8",
        "project_id": "19041904-1904-4904-8904-190419045001",
        "kind": "document",
        "label": "FRUS 1904, document 394",
        "attrs": {
          "experimental_source_identity": "frus:1904:394"
        },
        "created_at": "2026-09-14T00:00:00.000Z",
        "updated_at": "2026-09-14T00:00:00.000Z"
      }
    },
    {
      "op": "upsert",
      "entity": "evidence",
      "entity_id": "91098bd3-c704-5611-a634-a9ccb95cf34a",
      "payload": {
        "project_id": "19041904-1904-4904-8904-190419045001",
        "recorded_at": "2026-09-14T00:00:00.000Z",
        "created_at": "2026-09-14T00:00:00.000Z",
        "updated_at": "2026-09-14T00:00:00.000Z",
        "id": "91098bd3-c704-5611-a634-a9ccb95cf34a",
        "kind": "external_ref",
        "observation_id": null,
        "external_ref": "https://history.state.gov/historicaldocuments/frus1904/d394",
        "summary": "edition_text_inspected; locator {\"document_number\":\"394\",\"page\":{\"status\":\"unknown\",\"reason\":\"HTML page marker not inspected for this record\"}}",
        "provenance": {
          "kind": "document",
          "entity_id": "8ced5500-e3eb-552a-a32c-4a78a58d59a8",
          "external_id": "frus:1904:394",
          "label": "FRUS 1904, document 394"
        }
      }
    },
    {
      "op": "upsert",
      "entity": "reality_entity",
      "entity_id": "a17034de-144e-5acc-abc7-f154da14ef75",
      "payload": {
        "id": "a17034de-144e-5acc-abc7-f154da14ef75",
        "project_id": "19041904-1904-4904-8904-190419045001",
        "kind": "document",
        "label": "FRUS 1904, document 395",
        "attrs": {
          "experimental_source_identity": "frus:1904:395"
        },
        "created_at": "2026-09-14T00:00:00.000Z",
        "updated_at": "2026-09-14T00:00:00.000Z"
      }
    },
    {
      "op": "upsert",
      "entity": "evidence",
      "entity_id": "1101f982-b0f6-56fa-a281-b7c9331bb621",
      "payload": {
        "project_id": "19041904-1904-4904-8904-190419045001",
        "recorded_at": "2026-09-14T00:00:00.000Z",
        "created_at": "2026-09-14T00:00:00.000Z",
        "updated_at": "2026-09-14T00:00:00.000Z",
        "id": "1101f982-b0f6-56fa-a281-b7c9331bb621",
        "kind": "external_ref",
        "observation_id": null,
        "external_ref": "https://history.state.gov/historicaldocuments/frus1904/d395",
        "summary": "edition_text_inspected; locator {\"document_number\":\"395\",\"page\":{\"status\":\"unknown\",\"reason\":\"HTML page marker not inspected for this record\"}}",
        "provenance": {
          "kind": "document",
          "entity_id": "a17034de-144e-5acc-abc7-f154da14ef75",
          "external_id": "frus:1904:395",
          "label": "FRUS 1904, document 395"
        }
      }
    },
    {
      "op": "upsert",
      "entity": "reality_entity",
      "entity_id": "c092fac8-e72e-5007-a5f6-55040decb268",
      "payload": {
        "id": "c092fac8-e72e-5007-a5f6-55040decb268",
        "project_id": "19041904-1904-4904-8904-190419045001",
        "kind": "document",
        "label": "FRUS 1904, document 396",
        "attrs": {
          "experimental_source_identity": "frus:1904:396"
        },
        "created_at": "2026-09-14T00:00:00.000Z",
        "updated_at": "2026-09-14T00:00:00.000Z"
      }
    },
    {
      "op": "upsert",
      "entity": "evidence",
      "entity_id": "a9870395-b023-55e2-a12d-38e0e99efb57",
      "payload": {
        "project_id": "19041904-1904-4904-8904-190419045001",
        "recorded_at": "2026-09-14T00:00:00.000Z",
        "created_at": "2026-09-14T00:00:00.000Z",
        "updated_at": "2026-09-14T00:00:00.000Z",
        "id": "a9870395-b023-55e2-a12d-38e0e99efb57",
        "kind": "external_ref",
        "observation_id": null,
        "external_ref": "https://history.state.gov/historicaldocuments/frus1904/d396",
        "summary": "edition_text_inspected; locator {\"document_number\":\"396\",\"page\":{\"status\":\"unknown\",\"reason\":\"HTML page marker not inspected for this record\"}}",
        "provenance": {
          "kind": "document",
          "entity_id": "c092fac8-e72e-5007-a5f6-55040decb268",
          "external_id": "frus:1904:396",
          "label": "FRUS 1904, document 396"
        }
      }
    },
    {
      "op": "upsert",
      "entity": "reality_entity",
      "entity_id": "fc2a7d41-8eb2-58ab-ab64-784f9da801fd",
      "payload": {
        "id": "fc2a7d41-8eb2-58ab-ab64-784f9da801fd",
        "project_id": "19041904-1904-4904-8904-190419045001",
        "kind": "document",
        "label": "FRUS 1904, document 678",
        "attrs": {
          "experimental_source_identity": "frus:1904:678"
        },
        "created_at": "2026-09-14T00:00:00.000Z",
        "updated_at": "2026-09-14T00:00:00.000Z"
      }
    },
    {
      "op": "upsert",
      "entity": "evidence",
      "entity_id": "49046f63-ca50-5996-ab3b-581b6b25ddfa",
      "payload": {
        "project_id": "19041904-1904-4904-8904-190419045001",
        "recorded_at": "2026-09-14T00:00:00.000Z",
        "created_at": "2026-09-14T00:00:00.000Z",
        "updated_at": "2026-09-14T00:00:00.000Z",
        "id": "49046f63-ca50-5996-ab3b-581b6b25ddfa",
        "kind": "external_ref",
        "observation_id": null,
        "external_ref": "https://history.state.gov/historicaldocuments/frus1904/d678",
        "summary": "edition_text_inspected; locator {\"document_number\":\"678\",\"page\":{\"status\":\"unknown\",\"reason\":\"HTML page marker not inspected for this record\"}}",
        "provenance": {
          "kind": "document",
          "entity_id": "fc2a7d41-8eb2-58ab-ab64-784f9da801fd",
          "external_id": "frus:1904:678",
          "label": "FRUS 1904, document 678"
        }
      }
    },
    {
      "op": "upsert",
      "entity": "reality_entity",
      "entity_id": "f2ee7f08-c14f-5dea-aaa7-c961e81e7adc",
      "payload": {
        "id": "f2ee7f08-c14f-5dea-aaa7-c961e81e7adc",
        "project_id": "19041904-1904-4904-8904-190419045001",
        "kind": "document",
        "label": "FRUS 1904, document 679",
        "attrs": {
          "experimental_source_identity": "frus:1904:679"
        },
        "created_at": "2026-09-14T00:00:00.000Z",
        "updated_at": "2026-09-14T00:00:00.000Z"
      }
    },
    {
      "op": "upsert",
      "entity": "evidence",
      "entity_id": "00389928-abe5-5c74-a023-3cae4ae3da31",
      "payload": {
        "project_id": "19041904-1904-4904-8904-190419045001",
        "recorded_at": "2026-09-14T00:00:00.000Z",
        "created_at": "2026-09-14T00:00:00.000Z",
        "updated_at": "2026-09-14T00:00:00.000Z",